Physical Drive SMART information attached to RAID Controller 0

Device Id                      : 2
Slot Number                    : 0
Interface Type                 : SATA
SMART Attributes Data Revision Number: 1
Vender Specific SMART Attributes with Thresholds:
ID# ATTRIBUTE_NAME                  FLAG     VALUE WORST THRESHOLD TYPE      UPDATED  WHEN_FAILED RAW_VALUE
  5 Reallocated_Sectors_Count       0x0033   100   100   010       Pre-fail  Always       -       0
  9 Power_On_Hours                  0x0032   098   098   000       Old_age   Always       -       7559
 12 Power_Cycle_Count               0x0032   099   099   000       Old_age   Always       -       29
177 Wear_Leveling_Count             0x0013   099   099   005       Pre-fail  Always       -       24
179 Used_Rsvd_Blk_Count_ToTal       0x0013   100   100   010       Pre-fail  Always       -       0
180 Unused_Rsvd_Blk_Count_ToTal     0x0013   100   100   010       Pre-fail  Always       -       1420
181 Program_Fail_Count_Total        0x0032   100   100   010       Old_age   Always       -       0
182 Erase_Fail_Count_Total          0x0032   100   100   010       Old_age   Always       -       0
183 Runtime_Bad_Block               0x0013   100   100   010       Pre-fail  Always       -       0
184 End-To-End_Error                0x0033   100   100   097       Pre-fail  Always       -       0
187 Reported_Uncorrectable_Error    0x0032   100   100   000       Old_age   Always       -       0
190 Airflow_Temperature_Celsius     0x0032   072   065   000       Old_age   Always       -       28
194 Temperature_Celsius             0x0022   072   060   000       Old_age   Always       -       28 (Lifetime Min/Max 22/35)
195 Hardware_ECC_Recovered          0x001a   200   200   000       Old_age   Always       -       0
197 Current_Pending_Sector          0x0032   100   100   000       Old_age   Always       -       0
199 UltraDMA_CRC_Error_Count        0x003e   100   100   000       Old_age   Always       -       0
202 Mircon_SSD_Lifetime_Remain      0x0033   100   100   010       Pre-fail  Always       -       0
235 Unknown_Attribute               0x0012   099   099   000       Old_age   Always       -       18
241 Total_LBAS_Written              0x0032   099   099   000       Old_age   Always       -       4066670977
242 Total_LBAS_Read                 0x0032   099   099   000       Old_age   Always       -       44706268446
243 Unknown_Attribute               0x0032   100   100   000       Old_age   Always       -       0
244 Unknown_Attribute               0x0032   100   100   000       Old_age   Always       -       0
245 SanDisk_SSD_Lifetim_Remain      0x0032   100   100   000       Old_age   Always       -       65535
246 Unknown_Attribute               0x0032   100   100   000       Old_age   Always       -       65535
247 Unknown_Attribute               0x0032   100   100   000       Old_age   Always       -       65535
251 Unknown_Attribute               0x0032   100   100   000       Old_age   Always       -       4112892992



Device Id                      : 3
Slot Number                    : 1
Interface Type                 : SATA
SMART Attributes Data Revision Number: 1
Vender Specific SMART Attributes with Thresholds:
ID# ATTRIBUTE_NAME                  FLAG     VALUE WORST THRESHOLD TYPE      UPDATED  WHEN_FAILED RAW_VALUE
  5 Reallocated_Sectors_Count       0x0033   100   100   010       Pre-fail  Always       -       0
  9 Power_On_Hours                  0x0032   098   098   000       Old_age   Always       -       7559
 12 Power_Cycle_Count               0x0032   099   099   000       Old_age   Always       -       29
177 Wear_Leveling_Count             0x0013   099   099   005       Pre-fail  Always       -       24
179 Used_Rsvd_Blk_Count_ToTal       0x0013   100   100   010       Pre-fail  Always       -       0
180 Unused_Rsvd_Blk_Count_ToTal     0x0013   100   100   010       Pre-fail  Always       -       1427
181 Program_Fail_Count_Total        0x0032   100   100   010       Old_age   Always       -       0
182 Erase_Fail_Count_Total          0x0032   100   100   010       Old_age   Always       -       0
183 Runtime_Bad_Block               0x0013   100   100   010       Pre-fail  Always       -       0
184 End-To-End_Error                0x0033   100   100   097       Pre-fail  Always       -       0
187 Reported_Uncorrectable_Error    0x0032   100   100   000       Old_age   Always       -       0
190 Airflow_Temperature_Celsius     0x0032   072   065   000       Old_age   Always       -       28
194 Temperature_Celsius             0x0022   072   060   000       Old_age   Always       -       28 (Lifetime Min/Max 22/34)
195 Hardware_ECC_Recovered          0x001a   200   200   000       Old_age   Always       -       0
197 Current_Pending_Sector          0x0032   100   100   000       Old_age   Always       -       0
199 UltraDMA_CRC_Error_Count        0x003e   100   100   000       Old_age   Always       -       0
202 Mircon_SSD_Lifetime_Remain      0x0033   100   100   010       Pre-fail  Always       -       0
235 Unknown_Attribute               0x0012   099   099   000       Old_age   Always       -       18
241 Total_LBAS_Written              0x0032   099   099   000       Old_age   Always       -       4065117101
242 Total_LBAS_Read                 0x0032   099   099   000       Old_age   Always       -       44827220096
243 Unknown_Attribute               0x0032   100   100   000       Old_age   Always       -       0
244 Unknown_Attribute               0x0032   100   100   000       Old_age   Always       -       0
245 SanDisk_SSD_Lifetim_Remain      0x0032   100   100   000       Old_age   Always       -       65535
246 Unknown_Attribute               0x0032   100   100   000       Old_age   Always       -       65535
247 Unknown_Attribute               0x0032   100   100   000       Old_age   Always       -       65535
251 Unknown_Attribute               0x0032   100   100   000       Old_age   Always       -       4111636480



